{
  "schema_version": "mika.repo-handoff-map.v2",
  "generated_at": "2026-10-13T13:34:22.646946+00:00",
  "map_path": "docs/ai-dev/HANDOFF_MAP.json",
  "profiles": [
    "LEAN",
    "LIVE_SYSTEM"
  ],
  "analysis_baseline": {
    "repository_id": "R-1",
    "repository": "MikaMcFlurry/true-shuffle-PoC",
    "ref": "codex/implement-cloudflare-restart",
    "commit_sha": "09d772e0f05b0ce175777868bc07d8af53a09204",
    "intelligence_schema": "mika.repository-intelligence.v2",
    "intelligence_status": "ALIGNED",
    "packet_sha256": "74ceaa8f979284c8ac9bfee9c25c0daa47b593cc988a261e29a547e103bf7f52"
  },
  "write_scope": {
    "base_commit": "09d772e0f05b0ce175777868bc07d8af53a09204",
    "branch": "codex/implement-cloudflare-restart",
    "allowed_paths": [
      "AGENTS.md",
      "CODEX_START.md",
      "docs/ai-dev/EVIDENCE.json",
      "docs/ai-dev/EVIDENCE_MANIFEST.json",
      "docs/ai-dev/EXECUTION_PLAN.md",
      "docs/ai-dev/HANDOFF_MAP.json",
      "docs/ai-dev/MISSION.md",
      "docs/ai-dev/PROJECT_CONTEXT.md",
      "docs/ai-dev/REPOSITORY_INTELLIGENCE.md",
      "docs/ai-dev/repository-intelligence.json"
    ]
  },
  "roles": {
    "agent_entry": {
      "path": "AGENTS.md",
      "treatment": "UPDATE",
      "authority": "CANONICAL",
      "reason": "Actualexternalintegrated93241/873e/8bde100%; FRESHacceptanceBLOCKED LANE07,currentResumeexceptionpending;549/46/11/static/currentCI PASS; priorfixesclosed; currentINTEGRATED_932_REVIEW/LEDGER. Old09dpacket historical.",
      "evidence_ids": [
        "EV-01",
        "EV-02"
      ],
      "owner_decision_ids": [
        "D-01",
        "D-02",
        "D-03",
        "D-04",
        "D-05"
      ],
      "freshness_trigger": "Material source, deployment, owner intent or verification change; refresh binding before new claims."
    },
    "start_here": {
      "path": "CODEX_START.md",
      "treatment": "UPDATE",
      "authority": "CANONICAL",
      "reason": "Single mapped source for this responsibility; preserve incumbent evidence and distinguish target from runtime.",
      "evidence_ids": [
        "EV-01",
        "EV-02"
      ],
      "owner_decision_ids": [
        "D-01",
        "D-02",
        "D-03",
        "D-04",
        "D-05"
      ],
      "freshness_trigger": "Material source, deployment, owner intent or verification change; refresh binding before new claims."
    },
    "mission": {
      "path": "docs/ai-dev/MISSION.md",
      "treatment": "CREATE",
      "authority": "CANONICAL",
      "reason": "Single mapped source for this responsibility; preserve incumbent evidence and distinguish target from runtime.",
      "evidence_ids": [
        "EV-01",
        "EV-02"
      ],
      "owner_decision_ids": [
        "D-01",
        "D-02",
        "D-03",
        "D-04",
        "D-05"
      ],
      "freshness_trigger": "Material source, deployment, owner intent or verification change; refresh binding before new claims."
    },
    "owner_decisions": {
      "path": "docs/ai-dev/MISSION.md",
      "treatment": "CREATE",
      "authority": "CANONICAL",
      "reason": "Single mapped source for this responsibility; preserve incumbent evidence and distinguish target from runtime.",
      "evidence_ids": [
        "EV-01",
        "EV-02"
      ],
      "owner_decision_ids": [
        "D-01",
        "D-02",
        "D-03",
        "D-04",
        "D-05"
      ],
      "freshness_trigger": "Material source, deployment, owner intent or verification change; refresh binding before new claims."
    },
    "current_state": {
      "path": "docs/ai-dev/PROJECT_CONTEXT.md",
      "treatment": "CREATE",
      "authority": "GENERATED_VIEW",
      "reason": "Single mapped source for this responsibility; preserve incumbent evidence and distinguish target from runtime.",
      "evidence_ids": [
        "EV-01",
        "EV-02"
      ],
      "owner_decision_ids": [
        "D-01",
        "D-02",
        "D-03",
        "D-04",
        "D-05"
      ],
      "freshness_trigger": "Material source, deployment, owner intent or verification change; refresh binding before new claims."
    },
    "architecture_runtime": {
      "path": "docs/ai-dev/PROJECT_CONTEXT.md",
      "treatment": "CREATE",
      "authority": "GENERATED_VIEW",
      "reason": "Single mapped source for this responsibility; preserve incumbent evidence and distinguish target from runtime.",
      "evidence_ids": [
        "EV-01",
        "EV-02"
      ],
      "owner_decision_ids": [
        "D-01",
        "D-02",
        "D-03",
        "D-04",
        "D-05"
      ],
      "freshness_trigger": "Material source, deployment, owner intent or verification change; refresh binding before new claims."
    },
    "run_deploy_operations": {
      "path": "docs/ai-dev/PROJECT_CONTEXT.md",
      "treatment": "CREATE",
      "authority": "GENERATED_VIEW",
      "reason": "Single mapped source for this responsibility; preserve incumbent evidence and distinguish target from runtime.",
      "evidence_ids": [
        "EV-01",
        "EV-02"
      ],
      "owner_decision_ids": [
        "D-01",
        "D-02",
        "D-03",
        "D-04",
        "D-05"
      ],
      "freshness_trigger": "Material source, deployment, owner intent or verification change; refresh binding before new claims."
    },
    "production_baseline": {
      "path": "docs/ai-dev/PROJECT_CONTEXT.md",
      "treatment": "CREATE",
      "authority": "GENERATED_VIEW",
      "reason": "Single mapped source for this responsibility; preserve incumbent evidence and distinguish target from runtime.",
      "evidence_ids": [
        "EV-01",
        "EV-02"
      ],
      "owner_decision_ids": [
        "D-01",
        "D-02",
        "D-03",
        "D-04",
        "D-05"
      ],
      "freshness_trigger": "Material source, deployment, owner intent or verification change; refresh binding before new claims."
    },
    "product_truth": {
      "path": "PRODUCT.md",
      "treatment": "LINK",
      "authority": "CANONICAL",
      "reason": "Single mapped source for this responsibility; preserve incumbent evidence and distinguish target from runtime.",
      "evidence_ids": [
        "EV-01",
        "EV-02"
      ],
      "owner_decision_ids": [
        "D-03"
      ],
      "freshness_trigger": "Material source, deployment, owner intent or verification change; refresh binding before new claims."
    },
    "feature_inventory": {
      "path": "docs/ai-dev/REPOSITORY_INTELLIGENCE.md",
      "treatment": "CREATE",
      "authority": "GENERATED_VIEW",
      "reason": "Single mapped source for this responsibility; preserve incumbent evidence and distinguish target from runtime.",
      "evidence_ids": [
        "EV-01",
        "EV-02"
      ],
      "owner_decision_ids": [
        "D-01",
        "D-02",
        "D-03",
        "D-04",
        "D-05"
      ],
      "freshness_trigger": "Material source, deployment, owner intent or verification change; refresh binding before new claims."
    },
    "intelligence_markdown": {
      "path": "docs/ai-dev/REPOSITORY_INTELLIGENCE.md",
      "treatment": "CREATE",
      "authority": "GENERATED_VIEW",
      "reason": "Single mapped source for this responsibility; preserve incumbent evidence and distinguish target from runtime.",
      "evidence_ids": [
        "EV-01",
        "EV-02"
      ],
      "owner_decision_ids": [
        "D-01",
        "D-02",
        "D-03",
        "D-04",
        "D-05"
      ],
      "freshness_trigger": "Material source, deployment, owner intent or verification change; refresh binding before new claims."
    },
    "intelligence_json": {
      "path": "docs/ai-dev/repository-intelligence.json",
      "treatment": "CREATE",
      "authority": "GENERATED_VIEW",
      "reason": "Single mapped source for this responsibility; preserve incumbent evidence and distinguish target from runtime.",
      "evidence_ids": [
        "EV-01",
        "EV-02"
      ],
      "owner_decision_ids": [
        "D-01",
        "D-02",
        "D-03",
        "D-04",
        "D-05"
      ],
      "freshness_trigger": "Material source, deployment, owner intent or verification change; refresh binding before new claims."
    },
    "quality_risks": {
      "path": "docs/ai-dev/EXECUTION_PLAN.md",
      "treatment": "CREATE",
      "authority": "CANONICAL",
      "reason": "Single mapped source for this responsibility; preserve incumbent evidence and distinguish target from runtime.",
      "evidence_ids": [
        "EV-01",
        "EV-02"
      ],
      "owner_decision_ids": [
        "D-01",
        "D-02",
        "D-03",
        "D-04",
        "D-05"
      ],
      "freshness_trigger": "Material source, deployment, owner intent or verification change; refresh binding before new claims."
    },
    "execution_plan": {
      "path": "docs/ai-dev/EXECUTION_PLAN.md",
      "treatment": "CREATE",
      "authority": "CANONICAL",
      "reason": "Single mapped source for this responsibility; preserve incumbent evidence and distinguish target from runtime.",
      "evidence_ids": [
        "EV-01",
        "EV-02"
      ],
      "owner_decision_ids": [
        "D-01",
        "D-02",
        "D-03",
        "D-04",
        "D-05"
      ],
      "freshness_trigger": "Material source, deployment, owner intent or verification change; refresh binding before new claims."
    },
    "verification_ledger": {
      "path": "docs/ai-dev/EVIDENCE.json",
      "treatment": "CREATE",
      "authority": "SUPPORTING",